{
  "system_version": "5.8.0",
  "last_updated": "2026-02-03T10:00:00Z",
  "reports": [
    {
      "id": "MVP-IDEAS-AGENT-ECONOMY-2026-02-01",
      "filename": "MVP-IDEAS-AGENT-ECONOMY-2026-02-01.html",
      "title": "MVP IDEAS AGENT ECONOMY 2026 02 01",
      "description": "Research report from 2026-02-01",
      "date": "2026-02-01",
      "category": "slm",
      "badges": [],
      "badge_colors": [],
      "featured": false,
      "version": "2.0"
    },
    {
      "id": "CEO-BRIEF-SLM-VERTICAL-AGENTS-DEEP-RESEARCH-2026-01-30",
      "filename": "CEO-BRIEF-SLM-VERTICAL-AGENTS-DEEP-RESEARCH-2026-01-30.html",
      "title": "CEO BRIEF SLM VERTICAL AGENTS DEEP RESEARCH 2026 01 30",
      "description": "Research report from 2026-01-30",
      "date": "2026-01-30",
      "category": "slm",
      "badges": [],
      "badge_colors": [],
      "featured": false,
      "version": "2.0"
    },
    {
      "id": "LANDING-PAGE-MVP-IDEAS-6-CONSOLIDATED-2026-01-30",
      "filename": "LANDING-PAGE-MVP-IDEAS-6-CONSOLIDATED-2026-01-30.html",
      "title": "LANDING PAGE MVP IDEAS 6 CONSOLIDATED 2026 01 30",
      "description": "Research report from 2026-01-30",
      "date": "2026-01-30",
      "category": "slm",
      "badges": [],
      "badge_colors": [],
      "featured": false,
      "version": "2.0"
    },
    {
      "id": "FTAAS-CEO-DEEP-DIVE-2026-01-30",
      "filename": "FTAAS-CEO-DEEP-DIVE-2026-01-30.html",
      "title": "FTAAS CEO DEEP DIVE 2026 01 30",
      "description": "Research report from 2026-01-30",
      "date": "2026-01-30",
      "category": "slm",
      "badges": [],
      "badge_colors": [],
      "featured": true,
      "version": "2.0"
    },
    {
      "id": "SLM-PRODUCT-USP-PRICING-2026-01-30",
      "filename": "SLM-PRODUCT-USP-PRICING-2026-01-30.html",
      "title": "SLM Product USP & Pricing Strategy",
      "description": "Multi-agent research: 7 product concepts evaluated, TOP 3 ranked. #1 Rec: Cross-Platform LLM SDK (6-8wk MVP). Pricing: $49-499/mo tiers. Revenue: $1.9M Y1 → $60M Y3. 9 A/B landing page headlines ready for testing.",
      "date": "2026-01-30",
      "category": "slm",
      "badges": [
        "Research v5.3",
        "Multi-Agent",
        "Landing Page"
      ],
      "badge_colors": [
        "purple",
        "blue",
        "orange"
      ],
      "featured": true,
      "featured_label": "NEW - Landing Page Strategy",
      "version": "5.3"
    },
    {
      "id": "SLM-PLATFORM-MARKET-ANALYSIS-2026-01-29",
      "filename": "SLM-PLATFORM-MARKET-ANALYSIS-2026-01-29.html",
      "title": "SLM Platform Market Analysis - Beyond Web3",
      "description": "52 findings via 4 agents: Inferact $150M seed at $800M (biggest signal), Mirai Apple-only limitation, 9 unsolved pain points, 8 competitors mapped. Rec: Cross-Platform Enterprise Local AI Infrastructure.",
      "date": "2026-01-29",
      "category": "slm",
      "badges": [
        "Research v5.2",
        "Multi-Agent",
        "Series A"
      ],
      "badge_colors": [
        "purple",
        "blue",
        "green"
      ],
      "featured": true,
      "featured_label": "NEW - Latest Research",
      "version": "5.2"
    },
    {
      "id": "SLM-COMBINED-CEO-REPORT-2026-01-23",
      "filename": "SLM-COMBINED-CEO-REPORT-2026-01-23.html",
      "title": "SLM Combined CEO Q&A Report",
      "description": "Comprehensive CEO briefing synthesizing FTaaS, API Gateway, and Agent Marketplace research. Market sizing, competitive gaps, and Series A positioning.",
      "date": "2026-01-23",
      "category": "slm",
      "badges": [
        "CEO Briefing",
        "Synthesis",
        "Series A"
      ],
      "badge_colors": [
        "orange",
        "purple",
        "green"
      ],
      "featured": true,
      "featured_label": "CEO Q&A Synthesis",
      "version": "5.1"
    },
    {
      "id": "SLM-API-GATEWAY-FEASIBILITY-2026-01-28",
      "filename": "SLM-API-GATEWAY-FEASIBILITY-2026-01-28.html",
      "title": "SLM API Gateway - Feasibility Analysis",
      "description": "Deep feasibility analysis for crypto-native SLM API Gateway. OpenRouter leads ($500M), NO crypto-native gateway exists. $8M MRR opportunity with DeFi features.",
      "date": "2026-01-28",
      "category": "slm",
      "badges": [
        "Feasibility",
        "API Gateway",
        "Series A"
      ],
      "badge_colors": [
        "blue",
        "purple",
        "green"
      ],
      "featured": false,
      "version": "5.2"
    },
    {
      "id": "SLM-FINE-TUNING-SERVICE-FEASIBILITY-2026-01-28",
      "filename": "SLM-FINE-TUNING-SERVICE-FEASIBILITY-2026-01-28.html",
      "title": "SLM Fine-Tuning-as-a-Service - Feasibility Analysis",
      "description": "56 findings: $20.71B TAM, NO crypto-native FTaaS exists, 50-60% margins proven. Target: $20-25M Series A at $80-120M. Lead: Dragonfly Capital (10/10 fit).",
      "date": "2026-01-28",
      "category": "slm",
      "badges": [
        "Feasibility",
        "FTaaS",
        "Series A"
      ],
      "badge_colors": [
        "blue",
        "purple",
        "green"
      ],
      "featured": false,
      "version": "5.2"
    },
    {
      "id": "SLM-AGENT-MARKETPLACE-FEASIBILITY-2026-01-28",
      "filename": "SLM-AGENT-MARKETPLACE-FEASIBILITY-2026-01-28.html",
      "title": "SLM Agent Marketplace - Feasibility Analysis",
      "description": "Deep feasibility analysis for AI agent marketplace on Solana. Market sizing, competitive landscape, and Series A positioning for agent economy infrastructure.",
      "date": "2026-01-28",
      "category": "slm",
      "badges": [
        "Feasibility",
        "Agents",
        "Marketplace"
      ],
      "badge_colors": [
        "blue",
        "purple",
        "green"
      ],
      "featured": false,
      "version": "5.2"
    },
    {
      "id": "slm-fine-tuning-marketplace-competitive-analysis-2026-01-23",
      "filename": "slm-fine-tuning-marketplace-competitive-analysis-2026-01-23.html",
      "title": "slm fine tuning marketplace competitive analysis 2026 01 23",
      "description": "Research report from 2026-01-23",
      "date": "2026-01-23",
      "category": "slm",
      "badges": [],
      "badge_colors": [],
      "featured": false,
      "version": "2.0"
    },
    {
      "id": "research-slm-marketplace-opportunities-2026-01-23",
      "filename": "research-slm-marketplace-opportunities-2026-01-23.html",
      "title": "SLM Marketplace Opportunities - CEO Q&A & MVP Ideas",
      "description": "65 findings: 23 LLM vs SLM infrastructure gaps, vertical opportunities (DeFi/Solana/Legal), 7 one-dev MVP ideas. Top rec: Agentic AI SLM Marketplace with Solana Agent Kit integration.",
      "date": "2026-01-23",
      "category": "slm",
      "badges": [
        "Research v5.2",
        "CEO Q&A",
        "MVP Ready"
      ],
      "badge_colors": [
        "purple",
        "orange",
        "green"
      ],
      "featured": true,
      "featured_label": "NEW - CEO Q&A Research",
      "version": "5.2"
    },
    {
      "id": "research-slm-gateway-gtm-strategy-2026-01-23",
      "filename": "research-slm-gateway-gtm-strategy-2026-01-23.html",
      "title": "SLM API Gateway - Go-to-Market Strategy 2026",
      "description": "65 findings: Complete GTM playbook for Assisterr SLM Gateway. Pricing ($0.10-0.50/M tokens), 90-day launch plan ($300K ARR target), crypto-native moat (x402, wallet auth, SOL staking). Series A path: $15-25M at $75-150M.",
      "date": "2026-01-23",
      "category": "slm",
      "badges": [
        "Research v5.2",
        "GTM Strategy",
        "Series A Prep"
      ],
      "badge_colors": [
        "purple",
        "blue",
        "green"
      ],
      "featured": true,
      "featured_label": "NEW - GTM Playbook",
      "version": "5.2"
    },
    {
      "id": "research-slm-api-gateway-competitive-analysis-2026-01-22",
      "filename": "research-slm-api-gateway-competitive-analysis-2026-01-22.html",
      "title": "SLM API Gateway - Competitive Analysis & Market Opportunity",
      "description": "42 findings: OpenRouter leads ($500M, 2.5M devs). LiteLLM open-source dominant. GAP: No crypto-native SLM gateway. Opportunity: $8M MRR with DeFi features (x402, wallet auth).",
      "date": "2026-01-22",
      "category": "slm",
      "badges": [
        "Research v5.1",
        "SLM Gateway",
        "Competitive Analysis"
      ],
      "badge_colors": [
        "purple",
        "blue",
        "green"
      ],
      "featured": false,
      "version": "5.1"
    },
    {
      "filename": "SLM-MARKET-EVOLUTION-2026-01-21.html",
      "id": "SLM-MARKET-EVOLUTION-2026-01-21",
      "featured": true,
      "badges": [
        "Research v5.1",
        "SLM",
        "Market Analysis"
      ],
      "badge_colors": [
        "purple",
        "primary",
        "green"
      ],
      "title": "SLM Market 2025-2026: Death or Evolution?",
      "description": "NEW: SLM market verdict: EVOLUTION NOT DEATH. $0.93B to $5.45B (28.7% CAGR). DeepSeek R1 distillation, LoRA fine-tuning, edge deployment driving growth.",
      "version": "5.1",
      "date": "2026-01-21",
      "category": "slm",
      "featured_label": "NEW - Latest Research"
    },
    {
      "filename": "LLM-VS-SLM-FEATURE-GAP-2026-01-21.html",
      "id": "LLM-VS-SLM-FEATURE-GAP-2026-01-21",
      "featured": true,
      "badges": [
        "Research v5.1",
        "Infrastructure",
        "1-Dev Buildable"
      ],
      "badge_colors": [
        "purple",
        "blue",
        "green"
      ],
      "title": "LLM vs SLM Feature Gap Analysis",
      "description": "23 infrastructure gaps identified. SLMs achieve 77-84% function calling (beat GPT-4). 8 buildable opportunities for 1-dev team with 100x cost advantage.",
      "version": "5.1",
      "date": "2026-01-21",
      "category": "slm",
      "featured_label": "NEW - Infrastructure"
    },
    {